curpusID,text,product,years,productID
微信公共号文章-1790,【.茂荔润长安】倒计时天！荔枝为媒，共赴茂名西安双城之约!“一骑红尘妃子笑，缘是茂名荔枝来”茂名荔枝文化源远流长，穿透了千年的厚重历史。近日，来自广东茂名“大唐荔乡”的荔枝，又将现身大唐的古都西安。为传承弘扬茂名悠久荔枝文化，推广茂名特色农业、旅游、文化发展亮点，全面展示“滨海绿城，好心茂名”城市新形象，月日晚在大唐芙蓉园紫云楼南广场内，茂名将赴西安举办“荔香润长安·好心扬茂名”西安茂名双城文化旅游交流会。本次活动将会有哪些亮点？下面，小编为你一一揭秘。一缕荔枝香甜将茂名和西安紧密相连从古至今，穿越千年，荔枝为媒，将茂名和西安两个城市紧密相连。自唐时起，海上丝绸之路就与陆上丝绸之路互为补足，沟通整个亚非欧大陆形成闭环。当年千里迢迢通过丝绸之路送往大唐宫廷的荔枝，正是来自于茂名的“贡园”，向杨贵妃推荐茂名荔枝的是冼夫人的第六代孙高力士。“新歌初谱荔枝香，岂独杨妃带笑尝。应是殿前高力士，最将风味念家乡。”曾任两广总督的阮元作诗论断，当年千里迢迢通过驿道送往大唐宫廷的荔枝，正是来自茂名。截图来源陕西历史博物馆微信公众号在中国纵横交错的高速公路网中，有一条编号的包茂高速，它北起内蒙包头市，向南经西安、重庆直抵广东茂名。荔枝为媒，早在一千三百年前，就有一条古驿道将茂名与当时的都城长安连接起来。此次“荔香润长安·好心扬茂名”西安茂名双城文化旅游交流会活动将重现“缘是茂名荔枝来”盛况，联通世纪海上丝绸之路节点城市和陆上丝绸之路起点城市，通过“荔枝高速”全面展示“滨海绿城，好心茂名”城市新形象。国家·省级荔枝现代农业产业园。曾群芳摄双城＂对话＂深挖两市文化内涵推动文化交流城市与城市的交流与互动是文旅产业合作发展的重要方式，如果说，海是茂名，城则是西安千年古都。茂名获评央视第一季《魅力中国城》冠军、最受观众喜爱魅力城市、十佳魅力城市，拥有茂名荔枝文化、冼夫人好心文化等极具底蕴的地方特色文化。《魅力中国城》竞演资料图而享有“天然历史博物馆”之称的西安则是国务院公布的首批国家历史文化名城，历史上有周、秦、汉、隋、唐等在内的个朝代在此建都，是世界四大古都之一，曾经作为中国首都和政治、经济、文化中心长达多年。为推动茂名西安双城文化交流，来自两市的学者：陕西省文联副主席兼任中国西部文艺研究会会长肖云儒、茂名市委党校行政学教研室主任郭柳纤、广东省冼夫人文化研究基地负责人姚国军、陕西省社会科学院学术委员会副主任张宝通将现场展开“对话”，探讨茂名及西安的文化历史渊源。大唐芙蓉园陕西皮影戏另外，小编还要剧透一个重磅消息！还有一位神秘大咖级嘉宾将到场助阵，敬请持续关注！活动现场两地传统文化，同台演绎“锣鼓咚咚响，鬼仔闪闪亮，台下人头涌，陶醉一大片。”那张木偶戏台，就像一扇窗，展现着世间的冷暖，高低起伏的吟唱，又仿若一股清泉，让人们获得心灵的滋养。具有多年历史的茂名高州木偶戏是国家非物质文化遗产，不仅获得本地普通老百姓的喜爱，在国内外文化艺术界也得到了很高的评价。在本次活动中，同在国家首批非物质文化遗产名录中的高州木偶戏和陕西皮影将同台演出，皮影戏和木偶戏的交错相融，南北文化的穿插交互，将给观众带来不一样的文化感受。国家级非遗项目单人木偶戏曾群芳摄此外，活动穿插了“唐妞食荔枝”、“剪采纳荔”剪纸互动、“香引静筵”电白沉香展示、“荔香肆溢”茂名味道品鉴等双城文化碰撞环节，擦出更多的“火花”。现场还将为西安人民送上多份＂茂名＂礼物茂名非遗：电白高脚狮向上拖动盖子，打开第一份🎁香引静筵向上拖动盖子，打开第二份🎁省级非遗：高州木刻画向上拖动盖子，打开第三份🎁更多惊喜现场揭晓！向上拖动盖子，打开第四份🎁历史尘烟悠悠远去，茂名荔枝岁岁常红。荔枝不止是一种水果，更是凝结成了一种文化，刺激了味蕾，连接了古今，沟通了世界，也让茂名和西安两市紧密相连。:点击观看茂名旅游宣传片视频更多链接悬挂于北京人民大会堂广东厅的巨幅图画《绿色长城》取材于茂名中国第一滩如今，滨海旅游业是海洋开发的重头戏。滨海茂名具有不可多得的旅游资源禀赋，沙滩、温泉、林带、海岛、丘陵、港口、文物古迹等资源组合，蕴含着巨大市场潜力和发展前景。在长达多公里的茂名海岸线上，拥有达到国际级水准的滨海资源。南海旅游岛年月，茂名市人民政府与华侨城集团签订了《全面战略合作框架协议》，双方将在旅游综合开发、市政配套建设等领域开展全面合作，加快推进茂名向东向南靠海发展战略和创建滨海旅游产业示范区。茂名滨海旅游业已进入历史上最好的发展时期。自《协议》签订以来，华侨城以“统一规划、科学开发”的重要原则来进行南海旅游岛开发建设。依托茂名滨海资源、森林生态资源、田园农业资源、本土文化资源等，以海洋文化旅游为主题，以文带旅，融入符合发展趋势的当代表达。拟将养生与旅游结合，满足客群全方位需求，让每个来到南海旅游岛的人，直观地触摸和感受茂名的文化底蕴。月日，让我们一起相约这场以荔枝为媒的文化盛事，一起见证茂名西安双城之约！！编辑/曾群芳,长安,2020,ID610
微信公共号文章-1794,"【.茂荔润长安】当茂名遇上西安一个南海之滨一个六朝古都从古至今，穿越千年，茂名和西安两个城市，荔枝为媒，紧密相连。在中国纵横交错的高速公路网中，有一条编号的包茂高速，它北起内蒙包头市，向南经西安、重庆直抵广东茂名。这条穿越南北的“大动脉”将南海与古都相连。作为包茂高速的枢纽的两大站点，这两座城市气质却截然不同——茂名是中国南海之滨好心之城，山海之间，无限风光；西安则是国家历史文化名城，承载五千多年的华夏文明，古老而神奇。两座城市在山水、文化、传统工艺、美食等方面都呈现出自身独特的魅力。当茂名遇上西安，会碰撞出怎样的文化火花？冼夫人——兵马俑冼夫人像兵马俑每个有历史的中国城市，都有自己的文化标志，比如茂名的冼夫人，西安的兵马俑。“我事三代主，唯用一好心。”“冼夫人”是茂名十大文化名片之一。冼太夫人一生致力于维护国家统一和民族团结，周恩来总理誉之为“中国巾帼英雄第一人”。作为“世界第八大奇迹”、中国古代辉煌文明的金字名片，兵马俑则是西安的标志。整齐排列的千军万马，仿佛将我们带回到华夏第一次大一统时的辉煌年代，这儿的每一张脸，在当年都是战功赫赫的将士。宝光塔——大雁塔宝光塔刘栋摄西安大雁塔人们认识一座城市，往往是从地标建筑开始的，地标建筑传递着城市的形象和品位。从高州宝光塔到西安大雁塔，塔作为历史的承载者之一，记录了一段段沉淀的历史，是城市的精神文化之魂。“南桥头，两渡如梭，横织江中锦绣；西岸尾，一塔似笔，直写天上文章”。从高州城向西南方向望去，可以见到一座巍然挺拔的宝塔高插云霄，这就是茂名的宝光塔。作为西安市旅游地标性建筑，大雁塔是众多中外游客来西安打卡的第一站。站在大雁塔下，仰望七级塔身，西风中仿佛传来了千年梵唱。长坡古城—明城墙长坡古城刘栋摄明城墙永宁门西安发布古镇与城墙的每个角落都在诉说着历史的故事。青石铺就的长巷，飘散的淡淡烟火，深处的“旧城遗址”…..在茂名的长坡古镇里，一起体味历史的深厚与悠长。若把西安这座历史古城比作一壶陈年佳酿，明城墙无疑是其中最醇厚的一杯。城墙上风云变幻，城墙下一砖一瓦，都是历史的见证与回眸。潘茂名纪念公园—钟鼓楼潘茂名纪念公园钟鼓楼潘茂名纪念公园,气势恢弘,以典雅、宁静的情调,吸引了不少游客前来观光游览,感受茂名深厚的文化及历史底蕴。古时击钟报晨，击鼓报暮，“晨钟暮鼓”一词由此而来。钟鼓楼位于西安市中心，是西安钟楼和西安鼓楼的合称，数百年屹立，萦怀过往，守望四方。茂名南海旅游岛—秦岭山脉华侨城南海旅游岛秦岭山脉南海旅游岛是茂名丰富文旅资源中的一颗明珠，兼具乡村、稻田、山岭、内湾、长滩、外海等自然、人文资源。在茂名市发展滨海旅游产业的路上，南海旅游岛具有成为“先行者”的扎实基础。秦岭山脉，高山耸立、彩云缭绕、河谷深邃、雾霭缠绵……大雾岭由云开山脉以及数十座海拔米以上的山峰组成，群山连绵不绝，高耸入云。山海交融，互相呼应。高州木偶戏—陕西皮影戏高州木偶戏曾群芳摄皮影戏高州木偶戏与陕西皮影戏同在国家首批非物质文化遗产名录中，也代表了茂名与西安两个不同城市的特色文化。“锣鼓咚咚响，鬼仔闪闪亮，台下人头涌，陶醉一大片。”高州木偶戏是广东省地区的传统戏剧，相传于明代万历年间传入高州，至今已有多年的历史。“张灯作戏调翻新，顾囊徘徊知逼真”，这首诗描写的正是陕西皮影戏。表演时，艺人们在白色幕布后面，一边操纵戏曲人物，一边用陕西特色的碗碗腔或弦板腔唱述故事，同时配以打击乐器和弦乐，有浓厚的秦人气息。文创街—咖啡创意街区茂名文创街茂名日报社全媒记者吴昊摄西安创业咖啡街区街道是城市文化的重要组成部分，在特色城市的建设中具有重要作用，比如茂名的南越文创街和西安的创业咖啡街区。特色咖啡馆、南越印象岭南文化主题酒店、民俗廊、艺术馆….你想要的，这个国家级旅游景区里都有！以茂名建市年份为名，茂名南越文创街是一个以主题文化、本土元素、创意街区、跨界美食、创客空间、生活社交等于一体的情景式生活美学中心。作为西安首个汇聚全球创客的咖啡主题街区，西安创业咖啡街区为众多创客衔接国际资源，推开世界之门，领略文创+科技+生活的完美融合。簸箕炊——甑糕簸箕炊甑糕每一个城市的背后，都有几道具有代表性的美食。茂名和西安的不同小吃，代表了不一样的味蕾记忆。大米碾磨成米浆，灌入簸箕中蒸煮至熟透，又白又滑口感弹的簸箕炊就新鲜出炉了。吃的时候把圆盘白玉般的簸箕炊切成方块，淋上一勺香浓的韭菜油或橄榄油、再往上面撒一把爽口的白芝麻，是每个茂名人魂牵梦萦的好滋味。甑糕是西安和关中地区特有的传统风味小吃，用糯米、蜜枣、红豆置铁甑上蒸制而成。最美味的食物，往往只需最简单的食材和下最细致的功夫。高州根子贡园—大唐芙蓉园高州根子贡园大唐芙蓉园一骑红尘妃子笑，缘是茂名荔枝来。从古至今，穿越千年，荔枝为媒，当年千里迢迢送往大唐宫廷的荔枝，正是来自于茂名的“贡园”。而大唐芙蓉园则是中国第一个全方位展示盛唐风貌的大型皇家园林式文化主题公园，在这里可以跨过时空长河，感受唐朝盛世。自古荔枝出茂名，传至西安世人知。悠悠千年过去，茂名与西安，注定在时代前行路上相伴。月日，来自茂名“大唐荔乡”的荔枝，又将现身古都西安。茂名市将以千年荔枝文化为引，携手华侨城带着茂名荔枝北上西安，在西安大唐芙蓉园共同举办以“荔香润长安，好心扬茂名”为主题的西安茂名双城文化旅游交流会，探寻茂名与西安的文化渊源，促进两城文化旅游交流碰撞。茂名西安双城之约已发出月日，约吗？文/事实派茂名转自/茂名发布",包头市,2020,ID611
微信公共号文章-1798,西安茂名双城互动，携手文旅合作！“一骑红尘妃子笑，缘是茂名荔枝来。”月日晚，在陕西省西安市极具盛唐风貌的大唐芙蓉园内，茂名荔枝成为最耀眼的元素。“荔香润长安·好心扬茂名”西安茂名双城文化旅游交流会在这里举行。活动由中共广东省茂名市委宣传部指导，茂名市文化广电旅游体育局主办，茂名华侨城投资发展有限公司承办。在这场穿越千年的双城互动中，两地专家学者探寻双城历史文化渊源，文艺展演再现“缘是茂名荔枝来”的盛况，两地文旅部门签订文化旅游合作框架协议，推动两地从历史走向未来。“荔香润长安—好心扬茂名”西安茂名双城文化旅游交流会现场。曾群芳摄双城缘续“大唐荔乡”送荔枝进“长安”当晚的大唐芙蓉园紫云楼华灯璀璨，南广场上展现出“红荔映窗”“唐妞食荔枝”“剪采纳荔”等荔枝互动造型，西安市民现场品尝新鲜的茂名荔枝。活动以朗诵诗人杜牧的《过华清宫三绝》名篇开场。节目中“采荔”姑娘的柔美与独有的“唐风曲调”，经典再现荔枝古时从茂名到长安，如今到西安的穿越交融之旅。“一骑红尘妃子笑，无人知是荔枝来”的典故，千百年来为世人所熟知。冼夫人的第六代孙高力士，通过驿道将家乡茂名“贡园”的荔枝千里迢迢送往大唐宫廷，杨贵妃见到鲜红的荔枝大喜。由于高力士的力荐，茂名荔枝由南逾北，成为朝廷贡品。茂名的古荔贡园内，唐代千年荔枝树至今还结着果。双城缘续，文化交融。“锣鼓咚咚响，鬼仔闪闪亮，台下人头涌，陶醉一大片。”同在国家首批非物质文化遗产名录中的茂名高州木偶戏和陕西皮影同台演出，皮影戏和木偶戏的交错相融，南北文化的穿插交互，给观众留下了深刻的印象。活动上，著名文化学者、陕西省作协主席贾平凹向茂名赠送一幅内容为“西安茂名——山海之谊，双城缘续”的书法，成为两座城市友好的见证。著名文化学者、陕西省作协主席贾平凹向茂名赠送书法作品，成为两座城市友好的见证。老闫摄“西安是历史悠久的内陆古都，茂名是风光旖旎的南海明珠，两地在文化旅游资源共享、优势互补、合作交流方面前景广阔。”西安市委常委、市政府党组成员马希良在致辞中表示，我们衷心地希望以此次活动为契机，进一步深化西安、茂名两地文化旅游业间的交流和合作，全面复苏激发文旅产业活力，共同推动文旅融合健康发展。丝路交汇古都视窗窥见茂名好心文化一带一路倡议，将海上丝绸之路关键节点的茂名与陆上丝绸之路起点的西安联系在了一起。“从古至今，从茂名到长安，一缕荔枝香甜穿越千年，使陆上丝绸之路与海上丝绸之路的文化交融，将两个城市紧密相连。”茂名市副市长吴世文向现场来宾讲述了茂名历史名人冼夫人和高力士的故事。他进一步表示，这次活动是加深西安与茂名两地在文化旅游方面的交流沟通，茂名和西安也从历史走向未来，走向文化旅游的交融和合作。当晚，古都视窗窥见茂名好心文化。舞台上，《冼夫人出征》、《向海而兴》、《茂名》等节目表演轮番登场；展区间，高脚狮、电白沉香、高州木刻画等茂名非物质文化遗产成为耀眼“明星”。籍此窗口，以冼夫人“我事三代主，唯用一好心”提炼的“好心文化”贯穿展演始终，浓墨重彩地推介了“滨海绿城，好心茂名”的城市文旅新形象。双城交流会现场。老闫摄双城交流会上，双方嘉宾探讨茂名及西安的文化历史渊源。老闫摄为推动茂名西安双城文化交流，来自两地的文化学者——陕西省文联副主席兼任中国西部文艺研究会会长肖云儒、茂名市委党校行政学教研室主任郭柳纤、广东省冼夫人文化研究基地负责人姚国军、陕西省社会科学院学术委员会副主任张宝通同台展开“对话”，探讨茂名及西安的文化历史渊源，在千丝万缕的历史联系中找到携手并进的未来方向。陆海牵手西安与茂名签订文旅合作协议西安与茂名相隔多公里，分处内陆和滨海，在文化旅游产业发展上有着“异曲同工”之势。今年月，西安推出条支持政策为文旅产业注入了“强心剂”，坚持项目引领、加速产业聚集是其重中之重。茂名拥有近公里的海岸线，近两年来引入华侨城集团开发南海旅游岛，把优质的滨海资源优势变成现实的产品优势和服务优势，串珠成链打造独具魅力的中国滨海度假旅游目的地。拥有巨量的文化、美食和旅游资源的西安，把“千年古都·常来长安”作为城市文旅品牌；兼具山海之美的茂名，地处国家发展战略区域——粤港澳大湾区、海南自由贸易试验区和北部湾经济区的“三圈交汇”之地，正在打造“滨海绿城，好心茂名”城市品牌。随着交通发展的跨越，两地文旅互动越加频繁。编号为的包茂高速北起内蒙古包头市，向南经西安、重庆直抵茂名，被称为“荔枝高速”。年，沿着这条高速开展“茂名荔枝北上古驿道的新发现之旅”，在终点站西安掀起了活动高潮。西安茂名互赠文化礼品。曾群芳摄西安茂名签订文化旅游合作框架协议。曾群芳摄活动上，西安市文化旅游局与茂名市文广旅体局共同签订两地文化旅游合作框架协议，确立了两座城市携手开创未来的方向。:▲点击观看视频:▲点击观看视频综合/茂名发布龙眼直播编辑/曾群芳,西安市,2020,ID612
微信公共号文章-1812,茂名城际公交约你共赏荔乡飘香茂名市交通建设投资集团有限公司茂名市城际公交有限公司服务监督电话：—,荔乡,2020,ID613
微信公共号文章-1814,茂名市民的后花园！你打卡了吗？合水村隶属广东省茂名市茂南区新坡镇，地处小东江与白沙河交汇处，面积平方公里，辖条自然村个村民小组，共多户多人。:三色合水丨红色——该村属年抗战时期革命老区，是当年三镇革命地下党指挥中心。丨古色——建村多年历史，文化底蕴深厚，内有古屋、古桥、古庙、古祠堂、古井等历史文物。丨绿色——近年来，合水村大力推进建设美丽乡村。▲合水渔琅渡口旧址▲合水古庙目前，合水村环村道路已实现硬底化，垃圾收集、雨污分流设施均已完善；建成个体闲小公园、个小广场，个约亩的荷花池；建成白沙河、小东江合水段“二河两岸风景带”和沿路、沿岸休闲健身绿道公里；岸边，棵垂柳随风多姿！▲小公园合水村作为广东省新农村建设示范片建设村庄，以点带面，大力推进新农村建设成效显著，年代表茂南区参加竞选评比，曾获得“县域经济交流会”茂名全市第一。岭南水乡合水城市生态湿地公园——该公园座落在茂名市茂南区新坡镇合水村委会内，处于茂名市小东江和白沙河的交汇处上游，水资源和湿地资源丰富，是典型的河口湿地。公园规划建设面积亩，其中水域面积亩，陆地面积亩。▲合水城市生态湿地公园规划图合水湿地公园环境优雅，交通便利。水路连通白沙河、小东江、梅江，往东朔流而上通高山桥、竹园桥、永久桥、官渡桥河段，往南顺流而下通镇盛镇、吴川、湛江，往北沿白沙河直上公馆、金塘。▲水文化长廊规划图置身湿地公园内，沿着公园绿道、章福绿道、市区小东江绿道轻松骑行，欣赏沿途旖旎风光；也可坐游艇环湖、绕河畅游白沙河、小东江、梅江，饱览两岸美景和美丽乡村新貌。▲公园栈道在公园内栈道漫步、在凉亭上坐看田园美景、品味出污泥而不染的荷花高贵品质、遥望白鹭戏水傲翔天地的矫健身影、欣赏柳叶摇曳婆娑的风姿，湿地自然生态景观尽收眼底，美哉！市民后花园合水美景美不胜收，被游客赞称为“茂名市民的后花园”。▲观鸟亭美丽宜居合水村大力推进人居环境整治，打造生态宜居新农村初建成效，村民们表示，像生活在花园里。▲村内道路硬底化▲村巷已全部安装太阳能灯▲旅游公厕▲党建主题公园▲污水处理站▲垃圾分类新时代文明实践示范站新坡镇合水村新时代文明实践站——展厅占地面积平方，展示图文并茂六大板块，是茂名市示范站。▲新时代文明实践站传统食品优数百年的传统工艺花生油；百年畅销秘制百年老字号豆豉；占据市区各大市场的柯记烧腊（鸭、鹅、乳猪、叉烧），均是合水村远近闻名传统食品。长寿之乡合水有岁以上健在老人人，岁健在老人人，最年长的岁，目前还行动自如。人杰地灵柯云峰柯云峰（年月-），企业家，广东茂名茂南区新坡镇合水村委新屋村人，工商管理硕士，中共党员，第十二届全国人大代表，大参林医药集团股份有限公司董事长。年月，柯云峰家族以亿元财富在福布斯中国富豪榜中排名第。近几年柯云峰积极参加家乡建设，为地方及家乡的文化教育扶贫等公益，捐资近万元。（新坡镇文化站供稿）柯刚明柯刚明，深圳市文体旅游局原副局长，出生于年月，年考入武汉体院本科学习。毕业后在国家体委历任委领导秘书、主任科员、副处长；深圳市体育局历任副处长、处长、副局长、局纪委书记，深圳世界大运会执行局正局级专职副局长、党组成员；现任深圳市体育总会副会长，深圳市老年人体育协会常务副主席。近年来柯刚明积极关心家乡文体旅游工作，为茂名市文体对外交流方面工作牵针引线、铺路搭桥，为茂名成功申办广东省第十六届全省运动会助力！（新坡镇文化站供稿）刘适兰刘适兰，年出生四川成都，亚洲第一位国际象棋国际特级大师。年结婚嫁入合水村委郁芬村，夫君柯刚明。现任中国深圳棋院院长、总教练。年至年连续九次获全国国际象棋比赛女子个人冠军。省劳动模范，全国“十佳”运动员。第六届、第七届全国政协委员。全国“三八”红旗手。“国家体育运动奖章”。北京年奥运会圣火传递深圳站火炬手。（新坡镇文化站供稿）柯碧柯碧，女，年月出生于茂名市茂南区新坡镇合水村人。年月本科毕业国际贸易专业，年月起，先后在茂名市水利局、茂名市委组织部、茂名市政府办公室、信宜市委、茂名市旅游局、现任茂名市国家保密局局长。年月被中共茂名市委、茂名市人民政府评为“茂名市‘.’抗洪救灾暨年度抗洪抢险救灾先进个人”；在任市旅游局局长期间，积极配合参与我市“魅力中国城”竞演系列活动，年茂名荣获魅力中国城第一届“十佳魅力城市”和“最受观众喜爱魅力城市”称号。（新坡镇文化站供稿）茂名市民后花园约吗综合/龙眼直播,合水村,2020,ID614
