curpusID,text,product,years,productID
微信公共号文章-3803,“我们的节日•元宵”—“传承非遗•春牛报喜”十二生肖画展元宵快乐“春牛报喜”生肖牛画展主办单位：茂名市文化广电旅游体育局承办单位：茂名市文化馆、茂名市非物质文化遗产保护中心、茂名市美术家协会组委会：主任：陈研副主任：冯照年成员：冯佐、曾东、赖为朝、邹志、赖阳郁、陈清华策展人：邹志、赖阳郁、陈清华设计：程芊、陈思宏统筹：麦伟颖、黄聪玲成人组《牛年快乐》陈达举国画《牛转乾坤》赖为朝国画《大地之晨曲》彭永强木刻画《招财进宝》吴思志《牛年吉祥》陈朝晖《辛丑大吉》冯洋《不负春光自奋蹄》陈志华《牛气冲天》杜焱《牛转新运》戴郁明《牛转乾坤》戴郁明《牛转鸿运》戴郁明《牛气冲天》戴郁明国画《扭转乾坤》庄伟涛国画《荔映福牛壮》周瑞国画《牛年大利》周瑞国画《牛年大吉》刘长东国画《牛转乾坤》刘长东国画《牛年好牛》李青游墙绘《春牛报喜》刘晓光、欧德强《幸福之光》何秋娟《守护》李笑玲国画《不负韶华》陈孤鸿国画《扭转乾坤》陈孤鸿国画《牛年好运》李祥基《群牛图》刘英宝《福牛庆丰收》曹贵彬《牛转乾坤》朱茂贤油画《耕种》袁菁《老子出关》张宝华《奔向》黄文《福娃报喜玉牛贺春》梁欣彤《牛来运转》陈豫茗《牛年大吉》林振威《牛年吉祥》何火仙《牛运亨通》何火仙《硕果累累牛壮年丰》何火仙《牛年吉祥》梁慧明《牛年吉祥》肖春妙《牛年快乐》卢亦强《牛年喜事多》冯婧媛《牛气冲天》林进威少儿组《福牛贺岁》梁靖涵（少儿）《牛年大吉》黄诗珊（少儿）《牛年福到》朱恒志（少儿）《牛年快乐》邱琦欢（少儿）《牛气冲天》杨明熹（少儿）《牛转乾坤》张冰瑜（少儿）曹乐彤《牛年大发》（少儿）陈贵彬《年年有余》（少儿）陈佳倚《喜庆》（少儿）陈丽媛《牛气冲天》（少儿）陈丽媛《牛气冲天》（少儿）陈丽媛《牛气冲天》（少儿）陈文彬《牛年快乐》（少儿）陈宣成《牛年快乐》（少儿）陈泳娴《牛年。好运》（少儿）陈羽韬《牛年大吉》（少儿）陈苑橙《福牛》（少儿）陈紫琪《牛气冲天》崔雅思《牛气冲天》（少儿）崔烨庭《开心小牛》（少儿）符敏仪《牛年大吉》（少儿）高梓涵《牛年大吉》（少儿）关诗怡《牛年快乐》（少儿）郭琳茵《福牛迎春》（少儿）何靖瑶《牛年大吉》（少儿）江咏昊《牛气冲天》（少儿）江语晴《牛年的第一场红包雨》（少儿）柯奕丞《金牛迎春》（少儿）柯雨铭《新年到》（少儿）柯梓恩《小奶牛》（少儿）赖芷妍《新年快乐》（少儿）李柏凝《牛年大吉》（少儿）李明远《年年有余》（少儿）李明远《牛年大吉》（少儿）李炜锋《吉祥》（少儿）李文文《迎新春》（少儿）李小甜《牛年大吉》（少儿）李咏怡《开心一家人》（少儿）李运柳《赐福》（少儿）梁耿诚《牛气冲天》（少儿）梁竣杰《牛转乾坤》（少儿）梁凯轩《福牛》（少儿）梁妙镁《牛气冲天》（）（少儿）梁妙镁《牛气冲天》()（少儿）梁湛《福牛》（少儿）梁芷瑜《牛年大吉》（少儿）林俊宇《美食年》（少儿）林俊宇《牛年大吉》（少儿）林钰姗《属你最牛》（少儿）林志远《福牛探亲》（少儿）刘星慧《财源滚滚》（少儿）刘星慧《恭喜发财》（少儿）刘星怡《草地上的牛》（少儿）刘语涵（牛年大吉）（少儿）刘芷辰《牛运当头》（少儿）刘芷伊《腾飞的牛》少儿陆芷晴《福牛呈瑞》（少儿）吕沛凝《福牛贺岁》（少儿）莫晋豪《牛年大吉》（少儿）邱郎琪《金源财宝》（少儿）邵俊皓牛气冲天（少儿）苏俊皓《牛年吉利》（少儿）谭馥馨《牛闲“识”》（少儿）谭皓文《牛年赐福》（少儿）谭建诺《牛年帅福》(少儿)谭泷楚《喜迎牛年》（少儿）谭雅仪《新年快乐》（少儿）谭意童《牛气冲天》（少儿）谭羽闵《红红火火迎新年》（少儿）王婧林《牛年有余》（少儿）王思桦《奔跑的牛》（少儿）韦彤《牛年贺岁》（少儿）吴伟华《牛年的心愿》（少儿）吴岳庭《牛气冲天》（少儿）伍琳欣《属你最牛》（少儿）冼靖轩《金年贺岁》（少儿）萧雅乐《送福牛牛》（少儿）谢梓琪《牛气冲天》（少儿）徐伟耀《牛气冲天》（少儿）许恒睿《金牛送福》（少儿）许晋浩《春牛报喜》（少儿）许钎钎牛年大吉（少儿）许悦《牛年有余》（少儿）许悦《新春快乐，牛年大吉》（少儿）许悦《新春快乐》（少儿）杨金泳《福牛呈祥》（少儿）杨双慈《飞向月亮的奶牛》（少儿）杨昕凌《牛年牛牛牛》（少儿）张锦《大吉大利》（少儿）郑淏铭《福牛送喜》（少儿）郑伊玲《牛气冲天》（少儿）郑懿轩《牛年暴富》（少儿）郑懿轩《牛气冲天》（少儿）郑钰琪《恭喜发财》（少儿）朱政希《牛运恒通》（少儿）来源/茂名市文化馆出品/茂名旅游融媒体中心,茂名市文化馆,2021,ID759
微信公共号文章-3810,全国脱贫攻坚先进个人②|陈长发：带领穷山村奔向“村美民富”月日，全国脱贫攻坚总结表彰大会在北京举行，对全国脱贫攻坚先进个人、先进集体进行了表彰。其中，就有一位来自化州的杰出代表光荣地走进了人民大会堂，作为全国脱贫攻坚先进个人获得者受到了表彰和嘉奖。他是化州市中垌镇公居村驻村第一书记兼扶贫工作队队长、中国铁路广州局集团三茂铁路股份有限公司副总经理陈长发。“参加全国脱贫攻坚总结表彰大会让我倍感振奋和光荣，这是党和国家对广大扶贫干部的充分肯定，更是一种鞭策和激励，增添了我们做好后续巩固拓展脱贫攻坚成果工作的信心和动力。”大会结束后，南方日报、南方+记者连线陈长发，他激动地说。连续年扎根化州贫困村陈长发是年到茂名化州市中垌镇公居村驻村的，至今已是第五个年头。初来乍到，陈长发发现，村里比他湖南山区老家还穷：没有正式商店、买肉靠商贩入村、打雷就停电数天、手机信号弱，出入要翻山越岭，村级自然资源贫乏，村民种植只能自给自足，发展先天条件严重不足。地少田少，如何增收脱贫？基础薄弱，如何振兴农村？精神贫困，如何激发自生动力？带着一系列的问题，陈长发扎根这里，放弃了节假日和双休日，进村入户，学会了当地方言“涯话”与村民们交流，全面掌握当地生产资源、发展潜力、规划方向、攻坚发力点，自下而上认真做好脱贫规划，制定建设美村、产业发展等八项扶贫任务，为贫困户量身订做了“一户一法”、“一户几法”组合式的帮扶措施。陈长发（中）走访贫困户，了解生产情况年来，陈长发通过摸实情、听诉求，发挥广铁优势，整合扶贫资源，破解扶贫难题，按照“六个精准”帮扶，开展生动的脱贫攻坚实践。如今，公居村省定贫困村已脱贫摘帽，贫困户户人全部脱贫退出，全村人均可支配收入从年的元提高至元，有劳动能力贫困户人均可支配收入提高至元。美村、富村、示范村一点点变成现实：路灯村村亮了、道路桥梁村村通了、文化广场村村有了、残垣断壁村村清理了、中药牛大力种植产业园发展起来了，清洁队伍建立起来了，贫困户开始自力更生，一派新景象。产业“造血”鼓起村民钱袋子“扶贫就要帮到点上，扶到心上。”陈长发知道脱贫攻坚不是一朝一夕之功。他依托当地资源，左右协调，尽可能帮村民解决大小问难；他千方百计争取资金项目，用市场经济的思维，为贫困村民找到一条可以“自我造血”的脱贫路子。为了帮助公居村找到适合种养殖的产业项目，陈长发日夜思考，绞尽脑汁，先后余次上门考察对接惠州源茵生态园、广州百草园等种植养殖企业，还邀请两家企业进村现场调研，比对市场需求，问计于村民乡贤，最后他发现村党员刘付成亮家庭农场种植牛大力，收益可观。陈长发（右二）与村干部、村民察看牛大力种植情况年，广铁集团公司捐资万元投入到公居村集体经济种植牛大力亩，扶持村党员刘付成亮作为产业种植带头人，建成广铁扶贫中药牛大力产业基地。他改变以往贫困户单打独斗的经营方式，补齐了原家庭农场规模小、作业散的短板，协助搭建㎡晒场和㎡加工厂房，以“公居村委会+家庭农场+贫困户”为产业经营模式，推动整个公居村种植牛大力规模达到亩，初步形成“一村一品”产业特色品牌。公居村牛大力产业基地“消费扶贫能解决产销难题。”他积极汇报协调，通过以购代帮解决销路。帮扶促成广药集团陈李济与家庭农场达成年每年吨牛大力药材产品收购销售协议。帮助酿制牛大力酒，推动铁路单位内部购，让十斤百斤的牛大力酒、牛大力干片等源源不断地“走出去”，消费贫困村扶贫产品金额达.万元。他甚至自告奋勇担任推销员，积极争取珠江啤酒公司订购牛大力苗.万株。年月，陈长发以驻村第一书记身份在广州南站直播带货通过带动村级集体种植牛大力“造血”，村级集体经济收入每年分红近万元，计划可持续年。年以来村委会集体经济分红万元、户贫困户分散种植牛大力分红.万元，促使村级集体经济“破零”，鼓起了贫困户钱袋子。年，他又积极协助村委会向地方政府争取财政资金万元，继续投入到村种植牛大力产业，不断壮大村级集体经济。千方百计为贫困户“找碗饭”进村不久，陈长发就张罗着帮助贫困户就业，针对收入渠道少、贫中之贫的贫困户，他利用铁路吸纳贫困户务工政策绿色通道，深入宣传动员。“愿意到铁路务工吗？靠自己双手赚钱，只要勤劳就会过上好日子的！”他深入最困难的贫困户家中，了解需求、分析穷根，苦口婆心讲道理，提振脱贫信心。通过一次又一次的努力，现有名贫困村群众（贫困户名），被吸纳到广铁集团肇庆工务段道口工、汽车司机、线路工等岗位，月均收入达元，真正实现就业帮扶一户、成功脱贫一户的效果。同时，他为贫困村民提供就业信息和招工服务，年、年、年分别帮扶贫困人口人、人、人到外地务工，做到有劳动力家庭每户人外出打工，增加家庭收入，迈向生活新起点。办好实事提升百姓幸福指数“有困难，找陈书记！”贫困户有困难时，总是第一时间想到陈长发，跟他诉诉苦，找他想想招。面对贫困户需求，他总是耐心聆听、尽心帮忙。贫困户刘付志佳没钱改造危房，他走访建筑商，协调先建再还款；贫困户刘付亚龙因残疾无法务工，家里无经济收入供两个女儿读书，他主动帮助找宅基地建新房，申请助学金补贴；为巩固脱贫成效，他又向广铁集团申请扶贫基金款.万元，为户贫困户购置电视机、冰箱、洗衣机、热水器、煤气灶、沙发、餐桌椅等家具家电，改善贫困户家居生活条件。村民向陈长发提出：上公居村、下公居村和那哨村移民路桥年久失修，造成出行不便，能否帮忙向当地移民办申请新建？对于他来说，群众的难事，就是自己的事。他一次次走访化州市水务局移民办申请项目资金，冒着炎热陪着工程人员一米一米现场测量，短短一年时间里硬底化路面修好了，新桥建起了。年建设的大坪山桥年来，在广铁集团资助下，陈长发左右协调、上下联动，不畏辛苦，奋力推进建成了“室园灯校桥路广场”的广铁扶贫民生项目，即路、灯、桥、广场、小学校园、文化园、活动室、农村监控等项目，彻底补强公居村基础设施短板，达到村村通、路路亮、户户美，真正打造了带不走的民心工程，村容村面貌发生翻天覆地的变化。村里有了文体设施在他的努力下，以前有争议的村民房屋界限厘清了，鱼塘损毁赔偿了、坟地争议停止了、无户口村民入户了……一桩桩难办的事情，居然办好办成了，十多年没有解决的难题也解决了。为了改变乡村沉闷现状，他邀请广铁集团送文化下乡，组织名家到村现场文艺表演、书画创作，赠农业科技书籍，到公居小学开展第二课堂，引入乡村广场舞、乡村体育小运动会等活动，丰富村民文化活动。贫困村文化生活枯燥、精神空虚单调的现象慢慢得到改变，村民实实在在有了幸福感。提起这个外来干部，村民们都竖起了大拇指。少聚集:脱贫攻坚国家级表彰！茂名这些个人和集体上榜！市委常委会会议：高标准高质量推进党史学习教育，发扬“三牛精神”奋力推动“十四五”开好局起好步茂名发布编辑部编辑、制图：钟镇聪初审：柯柱基审核：杨永新来源：南方+,人民大会堂,2021,ID760
微信公共号文章-3823,【茂名非遗⑤】明朝末期传入化州的跳花棚舞，你看过吗？:《跳花棚》舞，又称《跳棚》、《高棚舞》，流传于广东茂名化州石湾街道办事处中火嶂山下中火嶂村委会长尾公村，明朝末期由姚氏七世祖(姚姓第七代)从福建福州府蒲昌县珠机巷大井头村迁居化州时传入。该舞曾流传化州官桥、那垭、梁村等地，后失传，长尾公村便成为唯一的跳棚村。地方志书对明、清两代州人民跳棚的情况略有记载：觐光门外沙洲为棚，城乡社会择善歌者，着童子傀衣、傀巾，夤夜持铃合歌合舞，奏鼓乐，上下坛场缓步。化州跳花棚介绍跳花棚，乃用竹子稻草在田头村边搭建之草棚，挂上大红灯笼及鲜花，演员少则十多人多至百人，饰以“七十二贤”及各种花草。跳棚舞有固定的演唱台本，分为接神、安座、开棚门、小孩儿、秀才、后生唱歌、锄田等场，内容多为农事耕耘、男女情感、生活趣谈，旨在驱邪除恶，祈求风调雨顺、物富民安、五谷丰登。每年秋收过后，化州官桥中火嶂一带村民，在村边田头搭起草棚，跳起原始粗犷的民俗舞“跳花棚”。表演者穿着古代服装，戴着怪异面具，手持斧头、镰刀、锄头等道具，在锣鼓号角伴奏下，边唱边舞，抒发“驱邪除恶，物阜民安”的喜悦心情。每到“跳花棚”表演的日子，都会吸引四邻八乡的人扶老携幼前来观看，盛况空前。“秋光好，跳棚舞，庆丰收，邪恶无。”这是上世纪六七十年代化州“跳棚舞”进入全盛时期的写照。但随着时代的变迁，农村的文化生活呈多元化，化州“跳花棚”一枝独秀的风光不再，到上世纪年代日渐式微，曾一度濒临失传，如今在当地文化部门的重视之下，才化险为夷。跳花棚反映了农耕文化形成的生活习俗和宗教信仰，是研究当时当地社会和生产力发展情况的一个重要历史物证，是研究民俗文化、宗教信仰的宝贵资料。年，该项目被列入第三批国家级非物质文化遗产代表性项目名录。年化州跳花棚参加茂名民间民俗艺术展演年化州跳花棚参加广东国际旅游文化节展演跳花棚参加佛山秋色巡游北京世园会“广东日”茂名专场活动少聚集:茂小布推荐市委理论学习中心组学习扩大会：中央宣讲团成员施芝鸿对党的十九届五中全会精神进行深入解读冷空气和降雨在路上，茂名接下来的天气…茂名发布编辑部编辑：钟镇聪黄文展初审：柯柱基审核：黄策来源：茂名市委宣传部,长尾公村,2021,ID761
微信公共号文章-3830,开往春天的班车，我们一起约起来！！！开往春天的班车春天是花的季节~春天在不经意间又来了，不管你的心情怎么样，春天的到来总是一件令人高兴的事，春天毕竟孕育着太多太多的希望！享·旅游找交投魅力茂名，时代乡村之旅高州粤龙山、杏花村（陈济棠旧居）汽车一天游出团日期：逢周六费用：元/成人行程特色杜鹃花海——粤龙山以打造亚洲最大杜鹃花种植园为目标，漫山遍野满目杜鹃花，色彩斑斓，令人陶醉。杏花村——具有新时代农村特色，充满知青时期的气息陈济棠故居——广东著名军阀陈济棠先生旧居，后称“民国大粮仓”，民国风格建筑，回顾历史。信宜镇隆窦州古城、鉴江源、石根山一日出团日期：逢周六费用：元/成人行程特色窦州古城：迄今已有一千三百多年历史，有着悠久的历史文化鉴江源：孕育高州、化州两地人民母亲河的源头石根山：海拔米，奇峰林立、怪石嶙峋，鬼斧神工妙似造化高州仙人洞观彩虹瀑布、赏禾雀花、竹海观景汽车纯玩一天游出团日期：逢周六费用：元/成人行程特色自然空调——仙人洞常年温度适宜，夏天清凉，感受来自大自然的馈赠禾雀花——国家二类保护植物，是植物界的奇珍异品，有“藤上奇花”之称瀑布奇观——落差达到多米的天河瀑布，让人叹为观止信宜莲花湖庄园、高州杏花村汽车一天出团日期：逢周六费用：元/成人行程特色莲花湖庄园——春日花海、摩天轮、依山傍水，风景美丽，隐藏在信宜中的一颗明珠杏花村——具有新时代农村特色，充满知青时期的气息陈济棠故居——广东著名军阀陈济棠先生旧居，后称“民国大粮仓”，民国风格建筑，回顾历史。信宜天马山、玻璃桥汽车一天游费用：元/成人详情化州红色柑村、廉江茗上茗茶苑、谢鞋山汽车一天游费用：元/成人详情温馨提示：以上包团可以根据实际需求调整。享·旅游找交投省内一日游，精彩过周末【爱国主义教育之旅】登军舰（湛江舰）、特呈岛一日游出团日期：参观军舰需要申请审批和预约~费用：元/成人行程特色登军舰——踏上退役军舰，兵哥哥带您近距离接触海上战士。全程自费购，品质纯玩！新会陈皮村、崖门古炮台一日游出团日期：逢周六费用：元/成人行程特色陈皮村：一两陈皮一两金，体验特色陈皮经济文化。崖门古炮台：时代虽变，历史流传开平立园、自力村碉楼村落一日游出团日期：逢周六费用：元/成人行程特色趁洋墟：复原旧时候的圩日场景，穿着旗袍穿梭当中，恍如穿越到昔日的繁华闹市好戏连台唱不停：粤剧、狮鼓表演、开平民歌，好戏不停，精彩轮番上演香车美人：坐黄包车，穿行在碉楼与华侨别墅当中，尊贵奢华，女王风范阳春石林赏花踏春、龙宫岩奇观汽车一天游费用：元/成人详情那琴半岛海洋公园、大澳渔家文化村汽车一天游费用：元/成人详情中国第一大火山岛“硇洲岛”汽车一天游费用：元/成人详情廉江鹤地水库纪念馆、田园寨观光汽车一天游费用：元/成人详情温馨提示：以上包团可以根据实际需求调整。享·旅游找交投单订门票也优惠·········更多优惠，请联系我们！我们是谁？茂名交投旅游！我们口号是？享·旅游找交投！我们的店面在？茂名交投旗下各汽车客运站！联系我们茂名交投国际旅行社（暨各大旅游集散中心）门店地址、电话.茂名市旅游集散中心咨询电话：柯先生（茂东营业部）吴小姐（茂西营业部）地址：茂名市站前四路号客运中心站（即交委车站）.电白区旅游集散中心咨询电话：蔡小姐地址：电白区水东镇人民路号（即电白汽车客运站）.高州市旅游集散中心咨询电话：周小姐地址：高州市河西路号（即高州汽车客运站）.信宜市旅游集散中心咨询电话：陈先生地址：信宜市人民南路号（即信宜汽车客运站）.化州市旅游集散中心咨询电话：彭小姐地址：化州市河东汽车总站旁.茂名交投国际旅行社（总部）咨询电话：-,粤龙山,2021,ID762
微信公共号文章-3835,茂名绿色化工研究院及绿色化工与新材料中试基地正式入驻，茂名清研先进新材料加速基地签约月日上午，茂名绿色化工研究院、茂名国家高新区绿色化工与新材料中试基地入驻仪式暨茂名清研先进新材料加速基地签约仪式在茂名高新区举行。市委书记、市人大常委会主任许志晖，市政协主席刘芳出席。月日，许志晖、刘芳等市领导参观茂名绿色化工研究院展厅和实验室。入驻仪式上，许志晖宣布茂名绿色化工研究院、茂名国家高新区绿色化工与新材料中试基地正式入驻，并与其他市领导一起为研究院、中试基地入驻揭牌。据悉，茂名绿色化工研究院、茂名国家高新区绿色化工与新材料中试基地是经市委、市政府决策成立的新型研发机构和中试平台，目前已经引入了支中试创新团队及位领军、紧缺拔尖人才。随后，许志晖、刘芳等市领导见证茂名高新区管委会与南京清研新材料研究院有限公司签订茂名清研先进新材料加速基地项目合作框架协议。根据协议，双方在茂名高新区合作建设先进新材料加速基地，形成集材料研发、孵化、产业加速于一体新材料产业创新体系，共同培育一批创新能力强、产品定位高、市场效益好的新材料企业。许志晖、刘芳等市领导还前往绿色化工与新材料中试基地、茂名清研先进新材料加速基地项目选址现场，实地了解中试基地、加速基地项目规划建设情况，并参观茂名绿色化工研究院展厅和实验室。许志晖强调要做细做实中试基地项目，进一步细化项目资金、合作模式、运营模式等方面内容，学习借鉴国际知名研究机构经验，打造共性技术和专业功能性中试平台，推动科技成果孵化育成和技术成果产业化落地，打造全国有名气的中试试验场所。要全力以赴加快推进加速基地项目落地见效，同时把加速基地项目的合作模式总结好、概括好、宣传好、推广好，吸引更多先进新材料项目来茂名，推动高新区产学研一体化有新突破。要在软硬件上下功夫，推动科技和资本“双孵化”，大力提升研究院和中试基地吸引力。市领导王创、吴刚强、李多民、崔锡明，市政协副厅级干部、茂名绿色化工研究院法定代表人、常务副院长章宁，广东石油化工学院党委副书记、副校长、茂名绿色化工研究院院长纪红兵出席活动。少聚集:茂小布推荐市委理论学习中心组学习扩大会：中央宣讲团成员施芝鸿对党的十九届五中全会精神进行深入解读冷空气和降雨在路上，茂名接下来的天气…文/茂名日报社全媒体记者赵艺通讯员茂新胡炜杰图/茂名日报社全媒体记者刘付思明茂名发布编辑部编辑：陈莹莹初审：柯柱基审核：黄策来源：茂名日报,茂名高新区,2021,ID763
